Product Name,Category,Description,Image Path,Shop Link
Lion King Cat,Costume Cats,"A majestic cat wearing a lion's mane hat that makes them look like the king of the jungle",data/images/cat.jpg,https://example.com/products/lion-king-cat
Happy Whiskers,Cheerful Cats,"An adorable cat with the sweetest smile that can brighten anyone's day",data/images/cat1.jpg,https://example.com/products/happy-whiskers
Grumpy Morning,Moody Cats,"A hilariously grumpy cat who's clearly been woken up from their nap too early",data/images/cat2.jpg,https://example.com/products/grumpy-morning
Sleepy Whiskers,Relaxed Cats,"A peaceful cat showing the art of perfect cat naps, completely unbothered by the world",data/images/cat3.jpg,https://example.com/products/sleepy-whiskers
Captain Whiskers,Professional Cats,"A distinguished cat in a pilot's outfit ready for takeoff",data/images/cat4.jpg,https://example.com/products/captain-whiskers 